<?xml version="1.0" encoding="UTF-8"?>
<TeesList xmlns:od="urn:schemas-microsoft-com:officedata" xmlns:xsi="http://www.w3.org/2001/XMLSchema-instance"  xsi:noNamespaceSchemaLocation="Tees.xsd" generated="2021-06-08T17:54:32">
<Tees>
<Tees>_</Tees>
<CourseRating>0</CourseRating>
<Slope>0</Slope>
<Back9>0</Back9>
</Tees>
<Tees>
<Tees>Black</Tees>
<CourseRating>36</CourseRating>
<Slope>135</Slope>
<Back9>1</Back9>
</Tees>
<Tees>
<Tees>Black</Tees>
<CourseRating>35.5</CourseRating>
<Slope>129</Slope>
<Back9>0</Back9>
</Tees>
<Tees>
<Tees>Blue</Tees>
<CourseRating>34.9</CourseRating>
<Slope>130</Slope>
<Back9>1</Back9>
</Tees>
<Tees>
<Tees>Blue</Tees>
<CourseRating>34.3</CourseRating>
<Slope>124</Slope>
<Back9>0</Back9>
</Tees>
<Tees>
<Tees>Gold</Tees>
<CourseRating>35</CourseRating>
<Slope>123</Slope>
<Back9>1</Back9>
</Tees>
<Tees>
<Tees>Gold</Tees>
<CourseRating>35</CourseRating>
<Slope>122</Slope>
<Back9>0</Back9>
</Tees>
<Tees>
<Tees>Silver</Tees>
<CourseRating>37</CourseRating>
<Slope>139</Slope>
<Back9>1</Back9>
</Tees>
<Tees>
<Tees>Silver</Tees>
<CourseRating>36.8</CourseRating>
<Slope>130</Slope>
<Back9>0</Back9>
</Tees>
</TeesList>
